{
  "schema_version": "1.0",
  "video_id": "signal_pedestrian_washington_dc",
  "review_status": "needs_manual_review",
  "video_metadata": {
    "fps": null,
    "frame_count": null,
    "width": null,
    "height": null
  },
  "objects": [],
  "narration_constraints": {
    "forbidden_phrases": [
      "길을 건너세요"
    ],
    "forbidden_patterns": [
      "보행자 신호"
    ],
    "maximum_duplicate_events": 0,
    "notes": "Never issue crossing advice. The current COCO detector does not establish a pedestrian subtype."
  },
  "review_notes": null
}
