{
  "schema_version": "1.0",
  "video_id": "bus_waiting_multiple_arrivals",
  "review_status": "needs_manual_review",
  "video_metadata": {
    "fps": null,
    "frame_count": null,
    "width": null,
    "height": null
  },
  "objects": [],
  "narration_constraints": {
    "forbidden_phrases": [],
    "forbidden_patterns": [],
    "maximum_duplicate_events": 0,
    "notes": "Do not add or confirm a route number until a human reviewer can read it reliably."
  },
  "review_notes": null
}
