{
  "schema_version": "1.0",
  "video_id": "bus_london_pulls_in",
  "review_status": "needs_manual_review",
  "video_metadata": {
    "fps": null,
    "frame_count": null,
    "width": null,
    "height": null
  },
  "objects": [],
  "narration_constraints": {
    "forbidden_phrases": [],
    "forbidden_patterns": [],
    "maximum_duplicate_events": 0,
    "notes": "Approach and route-number events are separate; unreadable route text must stay null."
  },
  "review_notes": null
}
