{
  "schema_version": "1.0",
  "video_id": "kiosk_like_reverse_vending_machine",
  "review_status": "needs_manual_review",
  "video_metadata": {
    "fps": null,
    "frame_count": null,
    "width": null,
    "height": null
  },
  "objects": [],
  "narration_constraints": {
    "forbidden_phrases": [
      "키오스크 화면이 바뀌었습니다"
    ],
    "forbidden_patterns": [
      "중 하나를 선택하는 화면입니다",
      "키오스크 화면에 .* 선택지가 있습니다"
    ],
    "maximum_duplicate_events": 0,
    "notes": "The supplied safety constraint forbids treating this machine as an ordering kiosk without detector evidence."
  },
  "review_notes": null
}
